{
  "statement": "A Pi transcript file is referenced by exactly one Session; recovery never chooses 'most recent' and never creates a new transcript at an old path.",
  "enforcement": [
    "runtime"
  ],
  "enforcedAt": [
    {
      "trigger": "daemon start",
      "frames": [
        {
          "symbol": "main",
          "anchor": "crates/axod/src/main.rs#main"
        },
        {
          "symbol": "serve_ipc",
          "anchor": "crates/axo-server/src/lib.rs#serve_ipc"
        },
        {
          "symbol": "SessionManager::open",
          "anchor": "crates/axo-server/src/session.rs#SessionManager::open"
        },
        {
          "symbol": "restore_open_sessions",
          "anchor": "crates/axo-server/src/session.rs#restore_open_sessions"
        },
        {
          "symbol": "recover_pi_shells",
          "anchor": "crates/axo-server/src/session.rs#recover_pi_shells"
        },
        {
          "symbol": "restart_unavailable_pi",
          "anchor": "crates/axo-server/src/session.rs#restart_unavailable_pi",
          "note": "rejects unless exactly one session owns the file"
        }
      ]
    },
    {
      "trigger": "axo.session.pi.restart.*",
      "frames": [
        {
          "symbol": "register_rpc_methods",
          "anchor": "crates/axo-server/src/session.rs#register_rpc_methods",
          "note": "axo.session.pi.restart.auto.v1 / force.v2"
        },
        {
          "symbol": "restart_unavailable_pi",
          "anchor": "crates/axo-server/src/session.rs#restart_unavailable_pi"
        }
      ]
    }
  ],
  "anchors": [
    "crates/axo-server/src/session.rs#restart_unavailable_pi",
    "docs/axod-recovery-hardening.md"
  ]
}
