{
  "statement": "During a Pi-driven extraction, agents cannot write or edit coverage ledger files directly; review entries are accepted and persisted through feynman_reviewed.",
  "enforcement": ["runtime"],
  "consequence": "Unverified or improperly formed review records cannot bypass the read-evidence and anchor checks through Pi's write/edit tools.",
  "enforcedAt": [
    {
      "trigger": "Pi write or edit tool call while extraction is active",
      "frames": [
        { "symbol": "tool_call handler", "anchor": "packages/pi-feynman/src/index.ts#tool_call", "note": "Blocks paths within the model coverage directory." },
        { "symbol": "Extraction.review", "anchor": "packages/modeler/src/extraction.ts#review", "note": "Writes accepted review entries via recordReviewed after checking tracked paths, read evidence, and anchors." }
      ]
    }
  ],
  "anchors": ["packages/pi-feynman/src/index.ts", "packages/modeler/src/extraction.ts"]
}
