{
  "statement": "A host credential is valid for exactly one host, is stored only as a verifier server-side, and is revoked by unlinking that host.",
  "enforcement": [
    "runtime",
    "test-time"
  ],
  "enforcedAt": [
    {
      "trigger": "pairing redemption",
      "frames": [
        {
          "symbol": "redeemHostPairing",
          "anchor": "packages/axo-api-worker/src/auth/pairing.ts#redeemHostPairing"
        },
        {
          "symbol": "AxoAccountManager.redeemPairing",
          "anchor": "packages/axo-api-worker/src/auth/account-manager.ts#redeemPairing",
          "note": "stores only the verifier; one host per credential"
        }
      ]
    },
    {
      "trigger": "a host connects",
      "frames": [
        {
          "symbol": "AxoHostRelay.fetch",
          "anchor": "packages/axo-api-worker/src/axo-host-relay.ts#fetch"
        },
        {
          "symbol": "authorizeRelayPeer",
          "anchor": "packages/axo-api-worker/src/auth/account-manager.ts#authorizeRelayPeer",
          "note": "account matches, host not revoked, verifier matches"
        }
      ]
    },
    {
      "trigger": "host revoked",
      "frames": [
        {
          "symbol": "revokeHost",
          "anchor": "packages/axo-api-worker/src/auth/account-manager.ts#revokeHost"
        },
        {
          "symbol": "closeHostRelay",
          "anchor": "packages/axo-api-worker/src/axo-host-relay.ts#closeHostRelay"
        }
      ]
    }
  ],
  "tests": [
    "packages/axo-api-worker/tests/auth.test.ts",
    "packages/axo-api-worker/tests/account-manager.test.ts"
  ],
  "anchors": [
    "packages/axo-api-worker/src/auth/account-manager.ts#redeemPairing",
    "packages/axo-api-worker/src/auth/account-manager.ts#authorizeRelayPeer",
    "packages/axo-api-worker/tests/auth.test.ts"
  ]
}
