{
  "statement": "Per pane, RPC input sequences start at zero and are consecutive; a repeat is acknowledged and ignored.",
  "enforcement": [
    "runtime"
  ],
  "enforcedAt": [
    {
      "trigger": "axo.terminal.input",
      "frames": [
        {
          "symbol": "register_rpc_methods",
          "anchor": "crates/axo-server/src/session.rs#register_rpc_methods",
          "note": "axo.terminal.input"
        },
        {
          "symbol": "write_terminal_input",
          "anchor": "crates/axo-server/src/session.rs#write_terminal_input",
          "note": "repeat: ignore; gap: reject"
        },
        {
          "symbol": "write_all",
          "anchor": "crates/axo-pty/src/process.rs#write_all",
          "note": "5 s timeout"
        }
      ]
    },
    {
      "trigger": "axo.remote.terminal.input",
      "frames": [
        {
          "symbol": "remote_request_reply",
          "anchor": "crates/axo-relay/src/relay.rs#remote_request_reply"
        },
        {
          "symbol": "remote_terminal_input",
          "anchor": "crates/axo-server/src/session.rs#remote_terminal_input"
        },
        {
          "symbol": "write_terminal_input",
          "anchor": "crates/axo-server/src/session.rs#write_terminal_input"
        }
      ]
    }
  ],
  "anchors": [
    "crates/axo-server/src/session.rs#write_terminal_input"
  ]
}
