{
  "statement": "Cloud host session snapshots expose only terminal shell identifiers plus presentation metadata. They omit Pi pane records, process IDs, PTY device names, local working directories, attachment paths and transcript paths; the layout is pruned to terminal panes.",
  "enforcement": [
    "runtime"
  ],
  "consequence": "Publishing local host paths or process/device identifiers would leak machine details and could expose the agent pane as a remotely controllable terminal.",
  "enforcedAt": [
    {
      "trigger": "Axod publishes a session snapshot to the host relay",
      "frames": [
        {
          "symbol": "RemoteSessionSnapshot.from_record",
          "anchor": "crates/axo-protocol/src/model.rs"
        }
      ]
    }
  ],
  "anchors": [
    "crates/axo-protocol/src/model.rs",
    "packages/axo-api/src/v1.ts"
  ],
  "sources": {
    "crates/axo-protocol/src/model.rs": "369822007fb06ca2d83964fb29fa20461ebe2a35",
    "packages/axo-api/src/v1.ts": "b940dbe4a2551fc13c4faf9815b616f6aeb14d35"
  }
}
