{
  "statement": "Only Pi writes its JSONL transcript; axod never writes or creates it.",
  "enforcement": [
    "runtime",
    "documented"
  ],
  "enforcedAt": [
    {
      "trigger": "a Pi pane is created",
      "frames": [
        {
          "symbol": "create_workspace_session",
          "anchor": "crates/axo-server/src/session.rs#create_workspace_session"
        },
        {
          "symbol": "spawn_new_pi",
          "anchor": "crates/axo-server/src/session.rs#spawn_new_pi"
        },
        {
          "symbol": "WriterLock::acquire",
          "anchor": "crates/axo-pi/src/lock.rs#WriterLock::acquire"
        },
        {
          "symbol": "spawn_pi",
          "anchor": "crates/axo-server/src/session.rs#spawn_pi",
          "note": "Pi inherits the lock; axod never writes the transcript"
        }
      ]
    }
  ],
  "anchors": [
    "crates/axo-pi/src/lock.rs",
    "docs/rfds/RFD0014-workspaces-and-agent-led-sessions.md"
  ]
}
