{
  "statement": "A subscriber's replay plus its live chunks are exactly the PTY stream: no gap, no duplicate.",
  "enforcement": [
    "runtime"
  ],
  "enforcedAt": [
    {
      "trigger": "a client attaches",
      "frames": [
        {
          "symbol": "handle_attachment",
          "anchor": "crates/axo-server/src/session.rs#handle_attachment",
          "note": "subscribe before replying"
        },
        {
          "symbol": "TerminalOutput::subscribe",
          "anchor": "crates/axo-pty/src/output.rs#TerminalOutput::subscribe",
          "note": "replay and subscription taken under one lock"
        }
      ]
    }
  ],
  "anchors": [
    "crates/axo-pty/src/output.rs",
    "crates/axo-server/src/session.rs"
  ]
}
