{
  "statement": "Terminal-provided OSC 8 and unknown-kind links are not dispatched directly: malformed, deceptive-character, inaccessible and executable local targets are denied, well-understood HTTP(S)/mailto and safe local files may open, and custom schemes require user confirmation. The alert displays normalized/escaped target text and Cancel is the default.",
  "enforcement": [
    "runtime"
  ],
  "consequence": "A terminal-produced link could otherwise dispatch to a registered application or open an executable/local target without the user seeing the effective destination.",
  "enforcedAt": [
    {
      "trigger": "libghostty issues an open-URL action",
      "frames": [
        {
          "symbol": "GhosttyRuntime.handleAction",
          "anchor": "apple/AxoMac/Sources/AxoMac/Terminal/GhosttyRuntime+Actions.swift"
        },
        {
          "symbol": "TerminalLinkPolicy.open",
          "anchor": "apple/AxoMac/Sources/AxoMac/Terminal/TerminalLinks.swift"
        },
        {
          "symbol": "UntrustedURL.decision",
          "anchor": "apple/AxoMac/Sources/AxoMac/Terminal/UntrustedURL.swift"
        },
        {
          "symbol": "UntrustedURLAlert.presentConfirmation / presentBlock",
          "anchor": "apple/AxoMac/Sources/AxoMac/Terminal/UntrustedURLAlert.swift"
        }
      ]
    }
  ],
  "tests": [
    "apple/AxoMac/Tests/AxoMacTests/UntrustedURLTests.swift"
  ],
  "anchors": [
    "apple/AxoMac/Sources/AxoMac/Terminal/TerminalLinks.swift",
    "apple/AxoMac/Sources/AxoMac/Terminal/UntrustedURL.swift",
    "apple/AxoMac/Sources/AxoMac/Terminal/UntrustedURLAlert.swift"
  ],
  "sources": {
    "apple/AxoMac/Sources/AxoMac/Terminal/GhosttyRuntime+Actions.swift": "788c0e62b0d12211b2f4d6f765e51d44365edf9c",
    "apple/AxoMac/Sources/AxoMac/Terminal/TerminalLinks.swift": "1b8cb13a8bdb3f5dc95b70c29d8db16a5979179c",
    "apple/AxoMac/Sources/AxoMac/Terminal/UntrustedURL.swift": "e756fa29333233d6379377840ae7bd6b43b057f6",
    "apple/AxoMac/Sources/AxoMac/Terminal/UntrustedURLAlert.swift": "3d61a2f98ebdd02d899c352f96fad85b91e1d52c",
    "apple/AxoMac/Tests/AxoMacTests/UntrustedURLTests.swift": "b412b512f0bf0130403bdc709d743dab74e149c6"
  }
}
