{
  "statement": "Every open Workspace has at least one open Session.",
  "enforcement": [
    "runtime"
  ],
  "consequence": "An open Workspace with nothing to show.",
  "enforcedAt": [
    {
      "trigger": "daemon start",
      "frames": [
        {
          "symbol": "main",
          "anchor": "crates/axod/src/main.rs#main"
        },
        {
          "symbol": "serve_ipc",
          "anchor": "crates/axo-server/src/lib.rs#serve_ipc"
        },
        {
          "symbol": "SessionManager::open",
          "anchor": "crates/axo-server/src/session.rs#SessionManager::open"
        },
        {
          "symbol": "ensure_open_workspace_sessions",
          "anchor": "crates/axo-server/src/session.rs#ensure_open_workspace_sessions",
          "note": "SQL: open workspaces with no open session"
        },
        {
          "symbol": "create_workspace_session",
          "anchor": "crates/axo-server/src/session.rs#create_workspace_session"
        }
      ]
    },
    {
      "trigger": "axo.session.close",
      "frames": [
        {
          "symbol": "register_rpc_methods",
          "anchor": "crates/axo-server/src/session.rs#register_rpc_methods",
          "note": "axo.session.close"
        },
        {
          "symbol": "close_session_and_publish",
          "anchor": "crates/axo-server/src/session.rs#close_session_and_publish"
        },
        {
          "symbol": "close_session",
          "anchor": "crates/axo-server/src/session.rs#close_session",
          "note": "last session in its workspace: create the replacement first"
        },
        {
          "symbol": "create_workspace_session",
          "anchor": "crates/axo-server/src/session.rs#create_workspace_session"
        }
      ]
    },
    {
      "trigger": "a shell exits",
      "frames": [
        {
          "symbol": "start_reaper",
          "anchor": "crates/axo-server/src/session.rs#start_reaper",
          "note": "thread, every 100 ms"
        },
        {
          "symbol": "reap_exited_sessions",
          "anchor": "crates/axo-server/src/session.rs#reap_exited_sessions"
        },
        {
          "symbol": "ensure_open_workspace_sessions",
          "anchor": "crates/axo-server/src/session.rs#ensure_open_workspace_sessions"
        }
      ]
    }
  ],
  "anchors": [
    "crates/axo-server/src/session.rs#ensure_open_workspace_sessions",
    "crates/axo-server/src/session.rs#close_session"
  ]
}
